[
  {
    "schemaVersion": "1.0",
    "eventId": "01ed4636-cb28-4269-af2c-eec936da6391",
    "eventType": "PROCESS_STARTED",
    "occurredAt": "2026-10-20T00:00:00Z",
    "environment": "verification",
    "serviceName": "member-service",
    "instanceId": "member-test-1",
    "deploymentVersion": "stage1-fixture",
    "traceId": "1234567890abcdef1234567890abcdef",
    "spanId": "1234567890abcdef",
    "processId": "SIGNUP-TEST-001",
    "processType": "MEMBER_SIGNUP",
    "processDefinitionVersion": "1",
    "aggregateVersion": 1,
    "status": "RUNNING"
  },
  {
    "schemaVersion": "1.0",
    "eventId": "5de4be0c-1324-4194-b562-9dc8a7926674",
    "eventType": "PROCESS_FINISHED",
    "occurredAt": "2026-10-20T00:00:00Z",
    "environment": "verification",
    "serviceName": "member-service",
    "instanceId": "member-test-1",
    "deploymentVersion": "stage1-fixture",
    "traceId": "1234567890abcdef1234567890abcdef",
    "spanId": "1234567890abcdef",
    "processId": "SIGNUP-TEST-001",
    "processType": "MEMBER_SIGNUP",
    "processDefinitionVersion": "1",
    "aggregateVersion": 2,
    "status": "REJECTED",
    "durationMs": 20
  },
  {
    "schemaVersion": "1.0",
    "eventId": "28df3699-ca1e-44ed-8597-4bbcc3adc009",
    "eventType": "STEP_STARTED",
    "occurredAt": "2026-10-20T00:00:00Z",
    "environment": "verification",
    "serviceName": "member-service",
    "instanceId": "member-test-1",
    "deploymentVersion": "stage1-fixture",
    "traceId": "1234567890abcdef1234567890abcdef",
    "spanId": "1234567890abcdef",
    "processId": "SIGNUP-TEST-001",
    "processType": "MEMBER_SIGNUP",
    "processDefinitionVersion": "1",
    "aggregateVersion": 1,
    "status": "RUNNING",
    "stepId": "CHECK_HR_EMPLOYEE",
    "stepExecutionId": "574b18e6-2491-46ec-8daa-6aea00459cd8",
    "attempt": 1
  },
  {
    "schemaVersion": "1.0",
    "eventId": "985e4312-8f1e-4e06-97f7-9c3fd4502374",
    "eventType": "STEP_FINISHED",
    "occurredAt": "2026-10-20T00:00:00Z",
    "environment": "verification",
    "serviceName": "member-service",
    "instanceId": "member-test-1",
    "deploymentVersion": "stage1-fixture",
    "traceId": "1234567890abcdef1234567890abcdef",
    "spanId": "1234567890abcdef",
    "processId": "SIGNUP-TEST-001",
    "processType": "MEMBER_SIGNUP",
    "processDefinitionVersion": "1",
    "aggregateVersion": 2,
    "status": "REJECTED",
    "stepId": "CHECK_HR_EMPLOYEE",
    "stepExecutionId": "519531ad-45bf-441b-b16c-1391af62369d",
    "attempt": 1,
    "durationMs": 20
  },
  {
    "schemaVersion": "1.0",
    "eventId": "9f5f1946-5c5e-424a-a004-d57c9915b4b4",
    "eventType": "ERROR_RECORDED",
    "occurredAt": "2026-10-20T00:00:00Z",
    "environment": "verification",
    "serviceName": "member-service",
    "instanceId": "member-test-1",
    "deploymentVersion": "stage1-fixture",
    "traceId": "1234567890abcdef1234567890abcdef",
    "spanId": "1234567890abcdef",
    "processId": "SIGNUP-TEST-001",
    "processType": "MEMBER_SIGNUP",
    "processDefinitionVersion": "1",
    "aggregateVersion": 1,
    "errorId": "dddc36f0-896e-4c2c-b2ca-1786e89e8473",
    "errorCode": "HR_NOT_ACTIVE",
    "errorCategory": "BUSINESS",
    "retryable": false,
    "message": "Employee is not active"
  }
]
